{"contract_version":1,"session_id":"S-example","score_kind":"partial_profile","confidence":"medium","band":null,"rubric":{"publisher":"IELTS","standard":"IELTS Speaking Band Descriptors","version":"current","source_reference":"https://ielts.org/"},"criteria":[{"criterion":"FC","score":6,"evidence":["Some hesitation"],"evidence_source":"transcript"},{"criterion":"LR","score":6,"evidence":["Adequate range"],"evidence_source":"transcript"},{"criterion":"GRA","score":6,"evidence":["Mixed structures"],"evidence_source":"transcript"}],"evidence_types":["transcript"],"priorities":["Develop answers"],"next_action":"Record a full audio mock."}
